Company,Topic_Count,Topics
frog,5,"AI-Powered Mentors, Experiential Learning Design, Manufacturing Skills Crisis, Immersive Learning Environments, Gamified Onboarding"
cobe,5,"Design System Consistency, UXi Method, Brand-Driven Design, Long-Term Partnerships, Transparent Communication"
designit,5,"Experience Innovation Company, Design-Led Innovation, Creative Pragmatism, Strategic Business Initiatives, Experience Advisory Practice"
diva,5,"Composable Loyalty Programs, Social Commerce Strategy, Digital Transformation Guide, Innovative Loyalty Initiatives, KI-gestützte CX"
ginetta,5,"Publication Submissions Flow, Managing Design Publications, Designer Portfolio Building, Medium Platform Writing, Design Idea Publishing"
phoenix design,5,"Showering Experience Design, Transparent OLED TV, Yoyo Design Innovation, Service Design Innovation, Sustainable Bathroom Design"
centigrade,5,"AI-Driven Modernization, Conversational AI UX, Anthropomorphic AI Design, AI Communication Style, Pragmatic Quality AI"
